Grant Activity Code,Grant Program Name,HRSA Program Area Name
U1V,Catalysts for Infant Health Equity ,Maternal and Child Health
T71,Leadership Education  in Adolescent Health (LEAH) ,Maternal and Child Health
H49,Healthy Start Initiative-Eliminating Racial/Ethnic Disparities ,Maternal and Child Health
T1C,Maternal and Child Health Public Health Catalyst Program ,Maternal and Child Health
U4A,American Rescue Plan Act – Pediatric Mental Health Care Access New Area Expansion ,Maternal and Child Health
T73,Leadership Education in Neurodevelopmental and Related Disorders Training Program ,Maternal and Child Health
D1J,Sickle Cell Disease Newborn Screening Follow-up Program ,Maternal and Child Health
T16,"MCH Leadership, Education, and Advancement in Undergraduate Pathways Program ",Maternal and Child Health
H17,Healthy Tomorrows Partnership for Children Program ,Maternal and Child Health
H84,Family Professional Partnership/CSHCN ,Maternal and Child Health
H61,Universal Newborn Hearing Screening and Intervention ,Maternal and Child Health
H18,MCHB State Systems Development Initiative ,Maternal and Child Health
U4C,Pediatric Mental Health Care Access Program ,Maternal and Child Health
U7E,Early Childhood Comprehensive Systems: Health Integration Prenatal to Three Program ,Maternal and Child Health
T79,Maternal and Child Health Nutrition Training Program ,Maternal and Child Health
T72,Pediatric Pulmonary Centers ,Maternal and Child Health
U1A,Thalassemia ,Maternal and Child Health
H33,EMSC Partnership Grants ,Maternal and Child Health
U1I,Regional Pediatric Pandemic Network ,Maternal and Child Health
U7A,State Maternal Health Innovation Program ,Maternal and Child Health
U2Z,Infant-Toddler Court Program ,Maternal and Child Health
H98,Awareness and Access to Care for Children and Youth with Epilepsy ,Maternal and Child Health
H6M,State Implementation Grants for Improving Services for Children and Youth with ASD ,Maternal and Child Health
UH9,National Coordinating Center (NCC) for the Regional Genetic Networks ,Maternal and Child Health
UK2,Early Childhood Health Promotion System for High Need Program ,Maternal and Child Health
U03,Pediatric Emergency Care Applied Research Network (PECARN) ,Maternal and Child Health
U4L,Pediatric Mental Health Care Access - EMSC Innovation and Improvement Center ,Maternal and Child Health
U01,Partnership for MCH Leadership Community ,Maternal and Child Health
U9H,Transforming Pediatrics for Early Childhood ,Maternal and Child Health
T76,"Centers of Excellence in MCH Education, Science and Practice Program ",Maternal and Child Health
UE8,MCH Navigator Program ,Maternal and Child Health
UA6,MCH Research Network Programs ,Maternal and Child Health
UH7,Regional Genetics Networks ,Maternal and Child Health
UF4,Home Visiting Collaborative Improvement and Innovation Network ,Maternal and Child Health
U1E,Sickle Cell Treatment Demonstration Program ,Maternal and Child Health
UT4,MCH Research Network on Promoting Healthy Weight (HW-RN) among Children with ASD and other DD ,Maternal and Child Health
U4J,Pediatric Mental Health Care Access Expansion ,Maternal and Child Health
UT6,Autism Transitions Research Project ,Maternal and Child Health
UD5,Home Visiting Research and Development Platform ,Maternal and Child Health
UC8,Comprehensive Hemophilia Diagnostic and Treatment Centers ,Maternal and Child Health
T77,Developmental-Behavioral Pediatrics Training Program ,Maternal and Child Health
U6D,Bridging the Word Gap Research Network ,Maternal and Child Health
H30,Hemophilia Treatment Centers (SPRANS) ,Maternal and Child Health
UJ6,Health Care Delivery System Innovations for Children with Medical Complexity ,Maternal and Child Health
UA5,Autism CARES Act National Interdisciplinary Training Resource Center ,Maternal and Child Health
R41,Autism Secondary Data Analysis Research (SDAR) Program ,Maternal and Child Health
H34,EMSC Targeted Issue Grants ,Maternal and Child Health
X10,"Maternal, Infant and Early Childhood Homevisiting Grant Program ",Maternal and Child Health
H4N,State Newborn Screening System Priorities Program ,Maternal and Child Health
A30,Alliance for Innovation on Maternal Health (AIM) Capacity ,Maternal and Child Health
U2C,Screening and Interventions for Adverse Childhood Experiences in Primary Care Settings Demonstration ,Maternal and Child Health
UT7,Autism Longitudinal Data Project ,Maternal and Child Health
UK3,Screening and Treatment for Maternal Depression and Related Behavioral Disorders Program ,Maternal and Child Health
R40,Maternal and Child Health Field-Initiated Research Program ,Maternal and Child Health
U52,Universal Newborn Hearing Screening - Cooperative Agreement ,Maternal and Child Health
U7B,Alliance for Innovation on Maternal Health (AIM)- Community Care Initiative ,Maternal and Child Health
UF7,Sudden Unexpected Infant Death Prevention Program ,Maternal and Child Health
UP4,Hereditary Hemorrhagic Telangiectasia (HHT) Program ,Maternal and Child Health
U2E,Integrated Maternal Health Services ,Maternal and Child Health
U4M,Pediatric Mental Health Care Access - American Academy of Pediatrics ,Maternal and Child Health
U02,MCH Advanced Education Policy ,Maternal and Child Health
U49,Child and Adolescent Injury and Violence Prevention Resource Centers Cooperative Agreement ,Maternal and Child Health
UK7,Networks for Oral Health Integration within the Maternal and Child Health Safety Net ,Maternal and Child Health
UM2,Enhancing Systems of Care for Children with Medical Complexity ,Maternal and Child Health
U22,Heritable Disorders ,Maternal and Child Health
U7N,Children’s Healthy Weight State Capacity Building Program ,Maternal and Child Health
UT5,Developmental-Behavioral Pediatrics Research Network ,Maternal and Child Health
U7C,State Maternal Health Innovation Support and Implementation Program ,Maternal and Child Health
U4D,Pregnancy Related Research Network ,Maternal and Child Health
R42,R42 MCH Secondary Data Analysis Research ,Maternal and Child Health
UG7,"National Fetal, Infant and Child Death Review Center Program ",Maternal and Child Health
UT9,Supporting Fetal Alcohol Spectrum Disorders (FASD) Screening and Intervention ,Maternal and Child Health
UT2,Autism Intervention Research Network on Physical Health ,Maternal and Child Health
UH0,Bright Futures for Women’s Health: Standard Practice Guidelines for Well Woman Care ,Maternal and Child Health
U8D,MCH Adolescent and Young Adult Health Research Network ,Maternal and Child Health
UR6,Maternal Health Research Network (MH-RN) for MSIs--Research Awards ,Maternal and Child Health
UR5,Maternal Health Research Network for Minority-Serving Institutions ,Maternal and Child Health
UJ5,EMSC Data Center ,Maternal and Child Health
UG4,Maternal and Child Environmental Health Network ,Maternal and Child Health
UE7,MCH Workforce Centers ,Maternal and Child Health
UC4,Alliance for Innovation on Maternal Health ,Maternal and Child Health
U59,National Maternal and Child Health Data Resource Center ,Maternal and Child Health
U5D,Pediatric Research Network Program ,Maternal and Child Health
R43,Autism Secondary Data Analysis Program ,Maternal and Child Health
U4N,Comprehensive Systems Integration for Adolescent and Young Adult Health ,Maternal and Child Health
U07,National Emergency Medical Services for Children (EMSC) Resource Centers Demonstration CA ,Maternal and Child Health
U2D,Infant-Toddler Court Program ,Maternal and Child Health
UT3,Autism Intervention Research Network on Behavioral Health ,Maternal and Child Health
U40,Family/Professional Partnership/ CSHCN ,Maternal and Child Health
U9D,Life Course Translational Research Network ,Maternal and Child Health
UU6,Institute for Home Visiting Workforce Development and Jackie Walorski Center for Evidence-Based Case ,Maternal and Child Health
B04,Maternal and Child Health Services ,Maternal and Child Health
H4B,Poison Control Stabilization and Enhancement Program ,Maternal and Child Health
UC1,Cooperative Newborn Screening System Priorities Program ,Maternal and Child Health
U04,Bright Futures Pediatric Implementation ,Maternal and Child Health
U1T,Building Systems of Services for Children and Youth with Special Health Care Needs ,Maternal and Child Health
H9E,Transition for Youth with Autism and/or Epilepsy Demonstration Projects ,Maternal and Child Health
U1X,Supporting Maternal and Child Health Innovation in States ,Maternal and Child Health
U2L,HRSA-24-041: National Coordinating Center on Transition (NCCT) ,Maternal and Child Health
US8,Center for Maternal and Child Health Medicaid Partnerships ,Maternal and Child Health
UF5,Supporting Healthy Start Performance Project ,Maternal and Child Health
U44,Oral Health ,Maternal and Child Health
H12,"Ryan White Title IV Women, Infants, Children, Youth and  Affected Family Members AIDS Healthcare ",HIV/AIDS
Q8M,Quality Improvement Fund – Maternal Health ,Primary Health Care
T34,Primary Care Training and Enhancement-Community Prevention and Maternal Health ,Health Workforce
